{
  "kind": "stop_request",
  "stopRequestId": "stop:sess-1:1",
  "appSession": "sess-1",
  "home": "H-acct",
  "generation": "gen:v1:s:736573732d31:h:482d61636374:n:1",
  "threadId": "thr-ex-1",
  "turnId": "turn-ex-3",
  "cause": "person-interrupt",
  "requestedBy": {
    "kind": "person",
    "identity": "person:ex-1",
    "identityStatus": "identity not verified"
  },
  "requestedAt": "2026-10-01T09:14:02.120Z",
  "clientRequest": "cr-sess-1/g1-17",
  "send": "sent",
  "response": "result",
  "turnOutcome": "interrupted",
  "outcomeSource": "observed",
  "outcomeLabel": "interrupted by the person",
  "itemsCompletedAfterRequest": [
    {
      "itemId": "item-ex-9",
      "itemType": "commandExecution"
    }
  ],
  "descendantsActiveAtOutcome": [
    {
      "kind": "child-thread",
      "ref": "thr-ex-2",
      "observedStatus": "active"
    }
  ],
  "itemsNotCompleted": [
    {
      "itemId": "item-ex-8",
      "itemType": "reasoning",
      "settled": "not completed (turn ended)"
    }
  ],
  "state": "settled",
  "transition": "SR-06"
}
